<?xml version="1.0" encoding="UTF-8"?>
<!-- edited with XMLSpy v2020 rel. 2 sp1 (x64) (http://www.altova.com) by  (European Commission - DG EUROSTAT) -->
<!-- Revision history: Feb 8th 2022 -->
<OUTL xmlns:xsi="http://www.w3.org/2001/XMLSchema-instance" xsi:noNamespaceSchemaLocation="../../XSD/OUTL.xsd">
	<!-- HH GROSS INCOME -->
	<variable id="HY040G">
		<formula>LOG</formula>
		<lb>
			<loc>Q1</loc>
			<k>3</k>
			<scal>IQR</scal>
		</lb>
		<ub>
			<loc>Q3</loc>
			<k>3</k>
			<scal>IQR</scal>
		</ub>
	</variable>
	<variable id="HY050G">
		<formula>LOG</formula>
		<lb>
			<loc>Q1</loc>
			<k>3</k>
			<scal>IQR</scal>
		</lb>
		<ub>
			<loc>Q3</loc>
			<k>3</k>
			<scal>IQR</scal>
		</ub>
	</variable>
	<variable id="HY060G">
		<formula>LOG</formula>
		<lb>
			<loc>Q1</loc>
			<k>3</k>
			<scal>IQR</scal>
		</lb>
		<ub>
			<loc>Q3</loc>
			<k>3</k>
			<scal>IQR</scal>
		</ub>
	</variable>
	<variable id="HY070G">
		<formula>LOG</formula>
		<lb>
			<loc>Q1</loc>
			<k>3</k>
			<scal>IQR</scal>
		</lb>
		<ub>
			<loc>Q3</loc>
			<k>3</k>
			<scal>IQR</scal>
		</ub>
	</variable>
	<variable id="HY080G">
		<formula>LOG</formula>
		<lb>
			<loc>Q1</loc>
			<k>3</k>
			<scal>IQR</scal>
		</lb>
		<ub>
			<loc>Q3</loc>
			<k>3</k>
			<scal>IQR</scal>
		</ub>
	</variable>
	<variable id="HY090G">
		<formula>LOG</formula>
		<lb>
			<loc>Q1</loc>
			<k>3</k>
			<scal>IQR</scal>
		</lb>
		<ub>
			<loc>Q3</loc>
			<k>3</k>
			<scal>IQR</scal>
		</ub>
	</variable>
	<variable id="HY100G">
		<formula>LOG</formula>
		<lb>
			<loc>Q1</loc>
			<k>3</k>
			<scal>IQR</scal>
		</lb>
		<ub>
			<loc>Q3</loc>
			<k>3</k>
			<scal>IQR</scal>
		</ub>
	</variable>
	<variable id="HY110G">
		<formula>LOG</formula>
		<lb>
			<loc>Q1</loc>
			<k>3</k>
			<scal>IQR</scal>
		</lb>
		<ub>
			<loc>Q3</loc>
			<k>3</k>
			<scal>IQR</scal>
		</ub>
	</variable>
	<variable id="HY120G">
		<formula>LOG</formula>
		<lb>
			<loc>Q1</loc>
			<k>3</k>
			<scal>IQR</scal>
		</lb>
		<ub>
			<loc>Q3</loc>
			<k>3</k>
			<scal>IQR</scal>
		</ub>
	</variable>
	<variable id="HY130G">
		<formula>LOG</formula>
		<lb>
			<loc>Q1</loc>
			<k>3</k>
			<scal>IQR</scal>
		</lb>
		<ub>
			<loc>Q3</loc>
			<k>3</k>
			<scal>IQR</scal>
		</ub>
	</variable>
	<variable id="HY140G">
		<formula>LOG</formula>
		<lb>
			<loc>Q1</loc>
			<k>3</k>
			<scal>IQR</scal>
		</lb>
		<ub>
			<loc>Q3</loc>
			<k>3</k>
			<scal>IQR</scal>
		</ub>
	</variable>
	<!-- HH NET INCOME -->
	<variable id="HY040N">
		<formula>LOG</formula>
		<lb>
			<loc>Q1</loc>
			<k>3</k>
			<scal>IQR</scal>
		</lb>
		<ub>
			<loc>Q3</loc>
			<k>3</k>
			<scal>IQR</scal>
		</ub>
	</variable>
	<variable id="HY050N">
		<formula>LOG</formula>
		<lb>
			<loc>Q1</loc>
			<k>3</k>
			<scal>IQR</scal>
		</lb>
		<ub>
			<loc>Q3</loc>
			<k>3</k>
			<scal>IQR</scal>
		</ub>
	</variable>
	<variable id="HY060N">
		<formula>LOG</formula>
		<lb>
			<loc>Q1</loc>
			<k>3</k>
			<scal>IQR</scal>
		</lb>
		<ub>
			<loc>Q3</loc>
			<k>3</k>
			<scal>IQR</scal>
		</ub>
	</variable>
	<variable id="HY070N">
		<formula>LOG</formula>
		<lb>
			<loc>Q1</loc>
			<k>3</k>
			<scal>IQR</scal>
		</lb>
		<ub>
			<loc>Q3</loc>
			<k>3</k>
			<scal>IQR</scal>
		</ub>
	</variable>
	<variable id="HY080N">
		<formula>LOG</formula>
		<lb>
			<loc>Q1</loc>
			<k>3</k>
			<scal>IQR</scal>
		</lb>
		<ub>
			<loc>Q3</loc>
			<k>3</k>
			<scal>IQR</scal>
		</ub>
	</variable>
	<variable id="HY090N">
		<formula>LOG</formula>
		<lb>
			<loc>Q1</loc>
			<k>3</k>
			<scal>IQR</scal>
		</lb>
		<ub>
			<loc>Q3</loc>
			<k>3</k>
			<scal>IQR</scal>
		</ub>
	</variable>
	<variable id="HY100N">
		<formula>LOG</formula>
		<lb>
			<loc>Q1</loc>
			<k>3</k>
			<scal>IQR</scal>
		</lb>
		<ub>
			<loc>Q3</loc>
			<k>3</k>
			<scal>IQR</scal>
		</ub>
	</variable>
	<variable id="HY110N">
		<formula>LOG</formula>
		<lb>
			<loc>Q1</loc>
			<k>3</k>
			<scal>IQR</scal>
		</lb>
		<ub>
			<loc>Q3</loc>
			<k>3</k>
			<scal>IQR</scal>
		</ub>
	</variable>
	<variable id="HY120N">
		<formula>LOG</formula>
		<lb>
			<loc>Q1</loc>
			<k>3</k>
			<scal>IQR</scal>
		</lb>
		<ub>
			<loc>Q3</loc>
			<k>3</k>
			<scal>IQR</scal>
		</ub>
	</variable>
	<variable id="HY130N">
		<formula>LOG</formula>
		<lb>
			<loc>Q1</loc>
			<k>3</k>
			<scal>IQR</scal>
		</lb>
		<ub>
			<loc>Q3</loc>
			<k>3</k>
			<scal>IQR</scal>
		</ub>
	</variable>
	<variable id="HY140N">
		<formula>LOG</formula>
		<lb>
			<loc>Q1</loc>
			<k>3</k>
			<scal>IQR</scal>
		</lb>
		<ub>
			<loc>Q3</loc>
			<k>3</k>
			<scal>IQR</scal>
		</ub>
	</variable>
	<variable id="HY145N">
		<formula>STD</formula>
		<lb>
			<loc>Q1</loc>
			<k>3</k>
			<scal>IQR</scal>
		</lb>
		<ub>
			<loc>Q3</loc>
			<k>3</k>
			<scal>IQR</scal>
		</ub>
	</variable>
	<!-- HH OVERALL INCOME -->
	<variable id="HY010">
		<formula>LOG</formula>
		<lb>
			<loc>Q1</loc>
			<k>3</k>
			<scal>IQR</scal>
		</lb>
		<ub>
			<loc>Q3</loc>
			<k>3</k>
			<scal>IQR</scal>
		</ub>
	</variable>
	<variable id="HY020">
		<formula>LOG</formula>
		<lb>
			<loc>Q1</loc>
			<k>3</k>
			<scal>IQR</scal>
		</lb>
		<ub>
			<loc>Q3</loc>
			<k>3</k>
			<scal>IQR</scal>
		</ub>
	</variable>
	<variable id="HY022">
		<formula>LOG</formula>
		<lb>
			<loc>Q1</loc>
			<k>3</k>
			<scal>IQR</scal>
		</lb>
		<ub>
			<loc>Q3</loc>
			<k>3</k>
			<scal>IQR</scal>
		</ub>
	</variable>
	<variable id="HY023">
		<formula>LOG</formula>
		<lb>
			<loc>Q1</loc>
			<k>3</k>
			<scal>IQR</scal>
		</lb>
		<ub>
			<loc>Q3</loc>
			<k>3</k>
			<scal>IQR</scal>
		</ub>
	</variable>
	<!-- PERSONAL GROSS INCOME -->
	<variable id="PY010G">
		<formula>LOG</formula>
		<lb>
			<loc>Q1</loc>
			<k>3</k>
			<scal>IQR</scal>
		</lb>
		<ub>
			<loc>Q3</loc>
			<k>3</k>
			<scal>IQR</scal>
		</ub>
	</variable>
	<variable id="PY020G">
		<formula>LOG</formula>
		<lb>
			<loc>Q1</loc>
			<k>3</k>
			<scal>IQR</scal>
		</lb>
		<ub>
			<loc>Q3</loc>
			<k>3</k>
			<scal>IQR</scal>
		</ub>
	</variable>
	<variable id="PY035G">
		<formula>LOG</formula>
		<lb>
			<loc>Q1</loc>
			<k>3</k>
			<scal>IQR</scal>
		</lb>
		<ub>
			<loc>Q3</loc>
			<k>3</k>
			<scal>IQR</scal>
		</ub>
	</variable>
	<variable id="PY050G">
		<formula>LOG</formula>
		<lb>
			<loc>Q1</loc>
			<k>3</k>
			<scal>IQR</scal>
		</lb>
		<ub>
			<loc>Q3</loc>
			<k>3</k>
			<scal>IQR</scal>
		</ub>
	</variable>
	<variable id="PY070G">
		<formula>LOG</formula>
		<lb>
			<loc>Q1</loc>
			<k>3</k>
			<scal>IQR</scal>
		</lb>
		<ub>
			<loc>Q3</loc>
			<k>3</k>
			<scal>IQR</scal>
		</ub>
	</variable>
	<variable id="PY080G">
		<formula>LOG</formula>
		<lb>
			<loc>Q1</loc>
			<k>3</k>
			<scal>IQR</scal>
		</lb>
		<ub>
			<loc>Q3</loc>
			<k>3</k>
			<scal>IQR</scal>
		</ub>
	</variable>
	<variable id="PY090G">
		<formula>LOG</formula>
		<lb>
			<loc>Q1</loc>
			<k>3</k>
			<scal>IQR</scal>
		</lb>
		<ub>
			<loc>Q3</loc>
			<k>3</k>
			<scal>IQR</scal>
		</ub>
	</variable>
	<variable id="PY100G">
		<formula>LOG</formula>
		<lb>
			<loc>Q1</loc>
			<k>3</k>
			<scal>IQR</scal>
		</lb>
		<ub>
			<loc>Q3</loc>
			<k>3</k>
			<scal>IQR</scal>
		</ub>
	</variable>
	<variable id="PY110G">
		<formula>LOG</formula>
		<lb>
			<loc>Q1</loc>
			<k>3</k>
			<scal>IQR</scal>
		</lb>
		<ub>
			<loc>Q3</loc>
			<k>3</k>
			<scal>IQR</scal>
		</ub>
	</variable>
	<variable id="PY120G">
		<formula>LOG</formula>
		<lb>
			<loc>Q1</loc>
			<k>3</k>
			<scal>IQR</scal>
		</lb>
		<ub>
			<loc>Q3</loc>
			<k>3</k>
			<scal>IQR</scal>
		</ub>
	</variable>
	<variable id="PY130G">
		<formula>LOG</formula>
		<lb>
			<loc>Q1</loc>
			<k>3</k>
			<scal>IQR</scal>
		</lb>
		<ub>
			<loc>Q3</loc>
			<k>3</k>
			<scal>IQR</scal>
		</ub>
	</variable>
	<variable id="PY140G">
		<formula>LOG</formula>
		<lb>
			<loc>Q1</loc>
			<k>3</k>
			<scal>IQR</scal>
		</lb>
		<ub>
			<loc>Q3</loc>
			<k>3</k>
			<scal>IQR</scal>
		</ub>
	</variable>
	<!-- PERSONAL NET INCOME -->
	<variable id="PY010N">
		<formula>LOG</formula>
		<lb>
			<loc>Q1</loc>
			<k>3</k>
			<scal>IQR</scal>
		</lb>
		<ub>
			<loc>Q3</loc>
			<k>3</k>
			<scal>IQR</scal>
		</ub>
	</variable>
	<variable id="PY020N">
		<formula>LOG</formula>
		<lb>
			<loc>Q1</loc>
			<k>3</k>
			<scal>IQR</scal>
		</lb>
		<ub>
			<loc>Q3</loc>
			<k>3</k>
			<scal>IQR</scal>
		</ub>
	</variable>
	<variable id="PY035N">
		<formula>LOG</formula>
		<lb>
			<loc>Q1</loc>
			<k>3</k>
			<scal>IQR</scal>
		</lb>
		<ub>
			<loc>Q3</loc>
			<k>3</k>
			<scal>IQR</scal>
		</ub>
	</variable>
	<variable id="PY050N">
		<formula>LOG</formula>
		<lb>
			<loc>Q1</loc>
			<k>3</k>
			<scal>IQR</scal>
		</lb>
		<ub>
			<loc>Q3</loc>
			<k>3</k>
			<scal>IQR</scal>
		</ub>
	</variable>
	<variable id="PY070N">
		<formula>LOG</formula>
		<lb>
			<loc>Q1</loc>
			<k>3</k>
			<scal>IQR</scal>
		</lb>
		<ub>
			<loc>Q3</loc>
			<k>3</k>
			<scal>IQR</scal>
		</ub>
	</variable>
	<variable id="PY080N">
		<formula>LOG</formula>
		<lb>
			<loc>Q1</loc>
			<k>3</k>
			<scal>IQR</scal>
		</lb>
		<ub>
			<loc>Q3</loc>
			<k>3</k>
			<scal>IQR</scal>
		</ub>
	</variable>
	<variable id="PY090N">
		<formula>LOG</formula>
		<lb>
			<loc>Q1</loc>
			<k>3</k>
			<scal>IQR</scal>
		</lb>
		<ub>
			<loc>Q3</loc>
			<k>3</k>
			<scal>IQR</scal>
		</ub>
	</variable>
	<variable id="PY100N">
		<formula>LOG</formula>
		<lb>
			<loc>Q1</loc>
			<k>3</k>
			<scal>IQR</scal>
		</lb>
		<ub>
			<loc>Q3</loc>
			<k>3</k>
			<scal>IQR</scal>
		</ub>
	</variable>